[
  {
    "concept_id": "meta_disease:breast_cancer",
    "preferred_label_en": "breast cancer",
    "zh_terms": [
      "乳腺癌"
    ],
    "synonyms_en": [
      "breast neoplasm",
      "mammary carcinoma"
    ],
    "concept_type": "disease",
    "pico_roles": [
      "population",
      "disease"
    ],
    "query_expansion_allowed": true,
    "standalone_search_allowed": "conditional",
    "requires_pairing_with": [],
    "filter_only": false,
    "pdf_extraction_target": true,
    "mesh_terms": [
      "Breast Neoplasms"
    ],
    "pubmed_free_text_terms": [
      "breast cancer"
    ],
    "emtree_terms": [],
    "emtree_review_status": "needs_review",
    "review_status": "seed_approved"
  },
  {
    "concept_id": "meta_disease:thyroid_cancer",
    "preferred_label_en": "thyroid cancer",
    "zh_terms": [
      "甲状腺癌"
    ],
    "synonyms_en": [
      "thyroid neoplasm",
      "thyroid carcinoma"
    ],
    "concept_type": "disease",
    "pico_roles": [
      "population",
      "disease"
    ],
    "query_expansion_allowed": true,
    "standalone_search_allowed": "conditional",
    "requires_pairing_with": [],
    "filter_only": false,
    "pdf_extraction_target": true,
    "mesh_terms": [
      "Thyroid Neoplasms"
    ],
    "pubmed_free_text_terms": [
      "thyroid cancer"
    ],
    "emtree_terms": [],
    "emtree_review_status": "needs_review",
    "review_status": "seed_approved"
  },
  {
    "concept_id": "meta_disease:type_2_diabetes_mellitus",
    "preferred_label_en": "type 2 diabetes mellitus",
    "zh_terms": [
      "2型糖尿病",
      "二型糖尿病"
    ],
    "synonyms_en": [
      "type 2 diabetes",
      "T2DM"
    ],
    "concept_type": "disease",
    "pico_roles": [
      "population",
      "disease"
    ],
    "query_expansion_allowed": true,
    "standalone_search_allowed": "conditional",
    "requires_pairing_with": [],
    "filter_only": false,
    "pdf_extraction_target": true,
    "mesh_terms": [
      "Diabetes Mellitus, Type 2"
    ],
    "pubmed_free_text_terms": [
      "type 2 diabetes mellitus"
    ],
    "emtree_terms": [],
    "emtree_review_status": "needs_review",
    "review_status": "seed_approved"
  },
  {
    "concept_id": "meta_disease:type_1_diabetes_mellitus",
    "preferred_label_en": "type 1 diabetes mellitus",
    "zh_terms": [
      "1型糖尿病",
      "一型糖尿病"
    ],
    "synonyms_en": [
      "type 1 diabetes",
      "T1DM"
    ],
    "concept_type": "disease",
    "pico_roles": [
      "population",
      "disease"
    ],
    "query_expansion_allowed": true,
    "standalone_search_allowed": "conditional",
    "requires_pairing_with": [],
    "filter_only": false,
    "pdf_extraction_target": true,
    "mesh_terms": [
      "Diabetes Mellitus, Type 1"
    ],
    "pubmed_free_text_terms": [
      "type 1 diabetes mellitus"
    ],
    "emtree_terms": [],
    "emtree_review_status": "needs_review",
    "review_status": "seed_approved"
  },
  {
    "concept_id": "meta_disease:lung_cancer",
    "preferred_label_en": "lung cancer",
    "zh_terms": [
      "肺癌"
    ],
    "synonyms_en": [
      "lung neoplasm",
      "pulmonary carcinoma"
    ],
    "concept_type": "disease",
    "pico_roles": [
      "population",
      "disease"
    ],
    "query_expansion_allowed": true,
    "standalone_search_allowed": "conditional",
    "requires_pairing_with": [],
    "filter_only": false,
    "pdf_extraction_target": true,
    "mesh_terms": [
      "Lung Neoplasms"
    ],
    "pubmed_free_text_terms": [
      "lung cancer"
    ],
    "emtree_terms": [],
    "emtree_review_status": "needs_review",
    "review_status": "seed_approved"
  },
  {
    "concept_id": "meta_disease:colorectal_cancer",
    "preferred_label_en": "colorectal cancer",
    "zh_terms": [
      "结直肠癌",
      "大肠癌"
    ],
    "synonyms_en": [
      "colon cancer",
      "rectal cancer"
    ],
    "concept_type": "disease",
    "pico_roles": [
      "population",
      "disease"
    ],
    "query_expansion_allowed": true,
    "standalone_search_allowed": "conditional",
    "requires_pairing_with": [],
    "filter_only": false,
    "pdf_extraction_target": true,
    "mesh_terms": [
      "Colorectal Neoplasms"
    ],
    "pubmed_free_text_terms": [
      "colorectal cancer"
    ],
    "emtree_terms": [],
    "emtree_review_status": "needs_review",
    "review_status": "seed_approved"
  },
  {
    "concept_id": "meta_disease:hepatocellular_carcinoma",
    "preferred_label_en": "hepatocellular carcinoma",
    "zh_terms": [
      "肝细胞癌"
    ],
    "synonyms_en": [
      "HCC",
      "liver cancer"
    ],
    "concept_type": "disease",
    "pico_roles": [
      "population",
      "disease"
    ],
    "query_expansion_allowed": true,
    "standalone_search_allowed": "conditional",
    "requires_pairing_with": [],
    "filter_only": false,
    "pdf_extraction_target": true,
    "mesh_terms": [
      "Carcinoma, Hepatocellular"
    ],
    "pubmed_free_text_terms": [
      "hepatocellular carcinoma"
    ],
    "emtree_terms": [],
    "emtree_review_status": "needs_review",
    "review_status": "seed_approved"
  },
  {
    "concept_id": "meta_disease:hypertension",
    "preferred_label_en": "hypertension",
    "zh_terms": [
      "高血压"
    ],
    "synonyms_en": [
      "high blood pressure"
    ],
    "concept_type": "disease",
    "pico_roles": [
      "population",
      "disease"
    ],
    "query_expansion_allowed": true,
    "standalone_search_allowed": "conditional",
    "requires_pairing_with": [],
    "filter_only": false,
    "pdf_extraction_target": true,
    "mesh_terms": [
      "Hypertension"
    ],
    "pubmed_free_text_terms": [
      "hypertension"
    ],
    "emtree_terms": [],
    "emtree_review_status": "needs_review",
    "review_status": "seed_approved"
  },
  {
    "concept_id": "meta_disease:coronary_artery_disease",
    "preferred_label_en": "coronary artery disease",
    "zh_terms": [
      "冠心病",
      "冠状动脉疾病"
    ],
    "synonyms_en": [
      "CAD",
      "coronary heart disease"
    ],
    "concept_type": "disease",
    "pico_roles": [
      "population",
      "disease"
    ],
    "query_expansion_allowed": true,
    "standalone_search_allowed": "conditional",
    "requires_pairing_with": [],
    "filter_only": false,
    "pdf_extraction_target": true,
    "mesh_terms": [
      "Coronary Artery Disease"
    ],
    "pubmed_free_text_terms": [
      "coronary artery disease"
    ],
    "emtree_terms": [],
    "emtree_review_status": "needs_review",
    "review_status": "seed_approved"
  },
  {
    "concept_id": "meta_disease:chronic_kidney_disease",
    "preferred_label_en": "chronic kidney disease",
    "zh_terms": [
      "慢性肾病",
      "慢性肾脏病"
    ],
    "synonyms_en": [
      "CKD",
      "chronic renal disease"
    ],
    "concept_type": "disease",
    "pico_roles": [
      "population",
      "disease"
    ],
    "query_expansion_allowed": true,
    "standalone_search_allowed": "conditional",
    "requires_pairing_with": [],
    "filter_only": false,
    "pdf_extraction_target": true,
    "mesh_terms": [
      "Renal Insufficiency, Chronic"
    ],
    "pubmed_free_text_terms": [
      "chronic kidney disease"
    ],
    "emtree_terms": [],
    "emtree_review_status": "needs_review",
    "review_status": "seed_approved"
  },
  {
    "concept_id": "meta_disease:stroke",
    "preferred_label_en": "stroke",
    "zh_terms": [
      "卒中",
      "脑卒中"
    ],
    "synonyms_en": [
      "cerebrovascular accident"
    ],
    "concept_type": "disease",
    "pico_roles": [
      "population",
      "disease"
    ],
    "query_expansion_allowed": true,
    "standalone_search_allowed": "conditional",
    "requires_pairing_with": [],
    "filter_only": false,
    "pdf_extraction_target": true,
    "mesh_terms": [
      "Stroke"
    ],
    "pubmed_free_text_terms": [
      "stroke"
    ],
    "emtree_terms": [],
    "emtree_review_status": "needs_review",
    "review_status": "seed_approved"
  },
  {
    "concept_id": "meta_disease:pancreatic_cancer",
    "preferred_label_en": "pancreatic cancer",
    "zh_terms": [
      "胰腺癌"
    ],
    "synonyms_en": [
      "pancreatic neoplasm"
    ],
    "concept_type": "disease",
    "pico_roles": [
      "population",
      "disease"
    ],
    "query_expansion_allowed": true,
    "standalone_search_allowed": "conditional",
    "requires_pairing_with": [],
    "filter_only": false,
    "pdf_extraction_target": true,
    "mesh_terms": [
      "Pancreatic Neoplasms"
    ],
    "pubmed_free_text_terms": [
      "pancreatic cancer"
    ],
    "emtree_terms": [],
    "emtree_review_status": "needs_review",
    "review_status": "seed_approved"
  },
  {
    "concept_id": "meta_disease:prostate_cancer",
    "preferred_label_en": "prostate cancer",
    "zh_terms": [
      "前列腺癌"
    ],
    "synonyms_en": [
      "prostatic neoplasm"
    ],
    "concept_type": "disease",
    "pico_roles": [
      "population",
      "disease"
    ],
    "query_expansion_allowed": true,
    "standalone_search_allowed": "conditional",
    "requires_pairing_with": [],
    "filter_only": false,
    "pdf_extraction_target": true,
    "mesh_terms": [
      "Prostatic Neoplasms"
    ],
    "pubmed_free_text_terms": [
      "prostate cancer"
    ],
    "emtree_terms": [],
    "emtree_review_status": "needs_review",
    "review_status": "seed_approved"
  },
  {
    "concept_id": "meta_disease:glioma",
    "preferred_label_en": "glioma",
    "zh_terms": [
      "胶质瘤",
      "脑胶质瘤"
    ],
    "synonyms_en": [
      "brain glioma"
    ],
    "concept_type": "disease",
    "pico_roles": [
      "population",
      "disease"
    ],
    "query_expansion_allowed": true,
    "standalone_search_allowed": "conditional",
    "requires_pairing_with": [],
    "filter_only": false,
    "pdf_extraction_target": true,
    "mesh_terms": [
      "Glioma"
    ],
    "pubmed_free_text_terms": [
      "glioma"
    ],
    "emtree_terms": [],
    "emtree_review_status": "needs_review",
    "review_status": "seed_approved"
  },
  {